{
  "schema_version": "2.0",
  "topic": "hanok",
  "topic_label": "Korean Architecture: Hanok",
  "genre": "architecture",
  "subtype": "hanok",
  "profile_id": "architecture.korean",
  "profile_version": "2.0.0",
  "workflow_mode": "REFERENCE_FRAME_RELAY",
  "duration_seconds": 30,
  "clip_duration_seconds": 10,
  "aspect_ratio": "9:16",
  "style_bible": {
    "identity_lock": "macro cinematography, 100mm lens, extreme close-up, soft focus pulls, Korean traditional wooden architecture, hanok, tiled roof, wooden beams, stone foundation",
    "materials": {
      "primary": [
        "wood",
        "clay tiles (giwa)",
        "stone foundation",
        "hanji paper windows",
        "ondol floor stones"
      ],
      "secondary": [
        "moss",
        "lichen",
        "seasonal foliage"
      ],
      "tools": [
        "miniature chisel",
        "tiny trowel",
        "brush",
        "magnifying glass",
        "wooden mallet"
      ]
    },
    "camera": {
      "lens": "100mm macro",
      "angle": "extreme_closeup",
      "movement": "soft_focus_pull",
      "distance": "extreme_macro"
    },
    "lighting": {
      "key": "soft directional morning light",
      "fill": "ambient skylight",
      "mood": "warm_cinematic",
      "consistency": "locked"
    },
    "color_palette": {
      "primary": [
        "warm wood tones",
        "terracotta",
        "stone gray"
      ],
      "accent": [
        "dancheong red/green/blue",
        "gold leaf"
      ],
      "background": "soft blurred nature",
      "tone": "warm_natural"
    },
    "workspace": {
      "surface": "dark wooden workbench",
      "environment": "traditional carpentry workshop",
      "clutter_rule": "organized_chaos"
    },
    "hands_rule": "giant_hands_only",
    "motion_rule": "stop_motion_assembly",
    "negative_prompt_base": "text, subtitle, caption, watermark, logo, burnt-in text, overlay text, bad anatomy, deformed hands, blurry, miniature people, tiny workers, shaky camera, camera shake, modern buildings, steel, concrete, glass curtain wall, neon lights, electricity"
  },
  "derived_fields": {},
  "scene_plans": [
    {
      "scene_id": 1,
      "name": "Foundation & Framework",
      "start_state": "Empty workbench with materials",
      "ordered_actions": [
        "Lay foundation stones",
        "Place base timbers",
        "Erect vertical posts",
        "Secure horizontal beams"
      ],
      "end_state": "Complete timber framework on stone foundation",
      "forbidden_changes": [
        "Workbench",
        "Lighting",
        "Camera angle",
        "Tool positions"
      ],
      "input_mode": "MASTER_IMAGE",
      "estimated_clip_duration_seconds": 10
    },
    {
      "scene_id": 2,
      "name": "Roof Structure",
      "start_state": "Framework ready for roof",
      "ordered_actions": [
        "Position rafters",
        "Place ridge beam",
        "Add purlins",
        "Lay clay tiles"
      ],
      "end_state": "Complete tiled roof with curved eaves",
      "forbidden_changes": [
        "Workbench",
        "Lighting",
        "Camera angle",
        "Established framework"
      ],
      "input_mode": "PREVIOUS_FINAL_FRAME",
      "estimated_clip_duration_seconds": 10
    },
    {
      "scene_id": 3,
      "name": "Walls, Details & Completion",
      "start_state": "Roof complete",
      "ordered_actions": [
        "Fit wall panels",
        "Install hanji windows",
        "Paint dancheong",
        "Place courtyard stones"
      ],
      "end_state": "Fully assembled hanok with tiled roof, paper windows, painted details, stone courtyard",
      "forbidden_changes": [
        "Roof structure",
        "Workbench",
        "Lighting",
        "Camera angle"
      ],
      "input_mode": "PREVIOUS_FINAL_FRAME",
      "estimated_clip_duration_seconds": 10
    }
  ],
  "scene_count": 3,
  "source_revision": "sha256:8a43ceb665e9a11acf0519712156019872e16d7ccc5cd64b865067bddfa6ca96",
  "flow_execution_profile_id": "google-veo2-9-16-10s",
  "nim_enabled": false,
  "nim_model_id": "",
  "nim_refinement_policy": "mutable_only",
  "provenance": {
    "source": "local_planner",
    "provider": "local",
    "model_id": "architecture.korean.v2",
    "base_url_label": "local",
    "generated_at": "2025-07-25T00:00:00Z",
    "request_id": "00000000-0000-0000-0000-000000000000",
    "source_revision": "sha256:8a43ceb665e9a11acf0519712156019872e16d7ccc5cd64b865067bddfa6ca96",
    "fallback_scene_ids": [],
    "validation_warnings": []
  }
}